class,RE,RENL,SWR,SKR,QR,CER,CS,ACF,CT,TAC,RT,RCF,TRC,RP,ExtLib,Sentiment,id,comment_text
u,73.99246376811597,89.46750000000003,0.3225806451612903,0.3225806451612903,0.0,0.6774193548387096,0.1200961153538153,0,0,107,1,5,215,52,0.0,1,56349536-2671,"	Super minor.  But I'd prefer this condition be ``` == ""LOCAL ``` so it's easier to immediately understand without having to double check the ``` != ```"
u,87.99727272727276,87.99727272727276,0.5714285714285714,0.5714285714285714,1.0,0.0714285714285714,0.3651483716701106,0,0,107,1,9,209,50,0.0,1,56249980-2668,"	you could probably use the same pattern (previous_stat) here, right?"
u,100.0,100.0,0.53125,0.53125,0.5,0.03125,0.1875228923753981,0,0,284,1,3,476,46,0.6422934064842316,1,56086590-2666,"	is all of this unit tested? it would be nice to see all the cases in plain unit tests if they dont exist, and a new case for pdqs.mobi"
u,82.01704545454547,82.01704545454547,0.6610169491525424,0.6610169491525424,0.5,0.0169491525423728,0.2534457226662686,0,0,284,1,3,476,46,0.6422934064842316,1,56087206-2666,"	also, if prod has to use pdqs.mobi but we cant do that for the other envs, does it even matter what we do on other envs, can we just use microsite-env.appspot.com?   i say that because this url mutilation we do on other products on our own platform haunts me at night"
u,81.85500000000002,81.85500000000002,0.6153846153846154,0.6153846153846154,1.0,0.0384615384615384,0.1273859510596964,2,1,284,1,5,472,45,1.0,0,56039779-2664,	you should be able to accomplish this with the _get_exclusive_properties method in vapi? or is that not returning the right error message?
u,87.61458333333336,87.61458333333336,0.6285714285714286,0.6285714285714286,0.0,0.0285714285714285,0.164275703458018,0,0,284,1,4,472,45,0.8764584747467858,1,56040065-2664,"	again, maybe get_exclusive_proprties can do this for you. Also the docstring for this process method may or may not be accurate. Kind of looks like not accurate at all lol"
u,81.84454545454548,99.49178571428574,0.35,0.35,0.0,0.3125,0.2515867249077596,36,1,2342,1,90,3645,673,0.8025617025756043,1,56045873-2664,"	Yeah! Let's use that thing!  So, `_get_exclusive_properties` only works if you're using the vapi Properties. If you're defining lists of args like you are in this handler, you can do the following: ``` REQUIRED_ARGS = [   ...   (API_KEY.ACCOUNT_SRID, API_KEY.CUSTOMER_IDENTIFIER)   ... ] ```  This will require one of the two arguments"
u,68.096,62.79000000000002,0.2592592592592592,0.2716049382716049,0.0,0.9629629629629628,0.534990610451275,0,0,67,1,2,2,1,0.0,1,56191426-2663,"	instead of setting ```current_stat``` you can enumerate ```stats``` in your loop.  EX. ``` for index, stat in enumerate(stats):   if not (stat and stat.value == 0) or index == 0:     continue      stat.value = data[index - 1] if data[index - 1] else 0   data.append([stat.datetime_stamp.strftime(formatting), stat.value]) ```"
u,46.60500000000002,100.0,0.4193548387096774,0.4193548387096774,0.5,0.6451612903225806,0.2506402059138015,3,1,107,1,9,197,46,0.0,0,55052488-2649,	It might be a bit late for this but I find ``` getGenerateReviewWidget ``` to be really confusing to read.  Could it be changed to ``` getWidgetForGenerateReviews ```?
u,41.876956521739146,55.38858695652178,0.2857142857142857,0.3928571428571428,0.0,0.5714285714285714,0.4740612223681573,0,0,748,0,0,1003,195,0.2215463857961917,1,55209092-2648,	All of these methods take a comment as the param.  Why not make a ReviewCommentActivity domain object that gets instantiated with a comment  ```python class ReviewCommentActivity(object):     def __init__(comment)     def is_valid(self)     @property     def link(self)     @property     def title(self)     def to_dict(self) ```
u,69.78500000000001,69.78500000000001,0.9,0.9,0.0,0.1,0.2696799449852968,0,0,748,0,0,1003,195,0.2215463857961917,1,55209278-2648,	The same could probably be done for ReviewActivity as well
u,30.842173913043496,66.36500000000001,0.4259259259259259,0.4259259259259259,0.0,0.2592592592592592,0.5106621799868927,0,0,748,0,0,1003,195,0.388988062922327,1,55210009-2648,	If you were to create the ReviewCommentActivity object you could encapsulate this logic into it. So all this would need to do is  ```python review_comment_activity = ReviewCommentActivity(activity) review_comment_activity.send() ``` Then the send method can decide whether or not to send the activity.
u,90.092,90.092,0.5555555555555556,0.5555555555555556,0.0,0.037037037037037,0.0,37,1,748,1,63,1003,195,0.2782629782977528,0,55210166-2648,	Pylint doesn't run for this file (for long lines anyway) and it's a lot more readable if these are all on one line.
u,66.7871428571429,66.7871428571429,0.4285714285714285,0.4285714285714285,1.0,0.1428571428571428,0.0,0,0,34,1,1,134,17,0.0,1,54906782-2642,	Are these colours supposed to be hardcoded?
u,100.0,100.0,0.3333333333333333,0.3333333333333333,1.0,0.1666666666666666,0.1767766952966368,0,0,0,1,5,22,2,0.0,0,53318133-2619,	Shouldn't this be a FilterBuilder?
u,35.60500000000002,35.60500000000002,0.4,0.4,0.0,0.2,0.1906925178491184,0,0,0,1,3,22,2,0.0,1,53319669-2619,	Same as above. FilterBuilder.
u,77.81071428571428,100.0,0.4705882352941176,0.4705882352941176,0.0,0.4705882352941176,0.0,2,1,748,1,2,996,190,0.0,1,52191004-2598,	if you rollback the `elasticsearch` lib you should rollback the `elasticsearch_dsl as well`
u,86.10589285714286,73.77989130434786,0.4189189189189189,0.4189189189189189,0.0,0.6486486486486487,0.271244490402245,0,0,107,1,4,189,42,0.0,1,51908333-2590,	I wonder if we should put a javascript ``` try catch ``` in here.   Having the entire page fail to load because we couldn't bind our tooltips seems like a bigger problem than edge support.  We might even be able to toss the check for ``` data.is_microsoft_edge ``` if we did that. It's generally a bad smell to have browser-specific functionality.
u,63.10363636363638,74.39580645161291,0.4473684210526316,0.4473684210526316,0.0,0.1052631578947368,0.2845904698636096,0,0,284,1,2,432,41,0.8709817675590193,0,51377151-2583,"	i think ``` expired_datetime ``` is a little clearer. first time reading this i thought this was supposed to be the datetime that the account expired at, so i was confused by the +1"
u,100.0,100.0,0.3636363636363636,0.4090909090909091,1.0,0.3181818181818182,0.220112726581406,0,0,93,1,18,567,35,0.0,1,51142876-2569,	Do you need a binding for `form-success-icon`? Can you just add it to the `class` attr?
u,67.53000000000003,76.50153846153849,0.3157894736842105,0.3157894736842105,0.0,0.2631578947368421,0.0710669054518701,0,0,93,1,18,567,35,0.0,1,51143002-2569,"	Minor, but I would argue `wrapper` would be a more natural naming convention than `area`."
u,84.92018292682928,73.17000000000003,0.5102040816326531,0.5102040816326531,0.0,0.6530612244897959,0.4233337566673017,7,1,748,1,16,978,186,0.9213595428201092,0,51204067-2568,"	`if 'page_title' not in context:` if you are just checking if the key exists.  I don't think anyone would set a blank `page_title`, and if they did, it was probably for a reason that's getting overwritten here."
u,48.09500000000003,86.14500000000002,0.55,0.55,0.0,0.225,0.2909286827258561,2,1,748,1,28,974,184,0.9697081074278776,0,50474793-2558,	This check should go into the `_can_send_review_share_email` as well  it doesn't really matter if we do an extra get on `ReviewGenerationConfigurationModel` when we aren't going to send the email anyway
u,85.88886363636365,56.75500000000002,0.3846153846153846,0.3846153846153846,0.0,0.6153846153846154,0.3934447376823168,0,0,2342,1,6,3603,665,0.0,1,49927773-2553,	infinite recursion!!!  should be `cls.get_by_account_group_id_async`
u,90.09000000000002,97.7025,0.4545454545454545,0.4545454545454545,0.0,0.5,0.3131121455425747,3,1,107,1,2,178,39,0.0,1,49463253-2537,"	The whole reason jasmine uses the ``` it ``` function is so you can write English sentences like: ``` it('should start as false', ... ``` .    Kind of sad to not take advantage that feature."
u,73.84500000000001,75.87500000000001,0.25,0.25,1.0,0.375,0.3268602252303067,0,0,93,0,0,462,32,0.0,1,49465524-2537,	Why is `template_type` optional here?
u,52.01950000000002,,0.2941176470588235,0.2941176470588235,0.0,1.0,0.3254722774520597,2,1,107,1,21,169,35,0.0,1,48563256-2511,	``` viewedComments ``` sounds to me like a function (or knockout object) that returns a set of viewed comments.  I'd recommend naming it something like ``` markCommentsAsViewed() ```.
u,68.69142857142859,68.69142857142859,0.48,0.48,0.0,0.04,0.5388159060803247,20,1,284,1,17,153,28,0.0,1,48564162-2511,	check if self.newComment() (is truthy) before sending the ajax call. dont need to send if theres no new comments anyway
u,37.640000000000015,37.640000000000015,0.4310344827586206,0.4310344827586206,0.0,0.0172413793103448,0.5194075207983329,5,1,284,1,7,153,28,0.0,1,48567624-2511,"	I would pull these 2 tests out into a different describe block. if you are describing ""markCommentsAsViewed"", then all of your tests inside that block should call markCommentsAsViewed. If you are calling commentsToggleString, even to test that it calls markCommentsAsViewed, that test should happen inside a describe(""commentsToggleString"", function(){tests})"
u,77.28750000000002,76.91375000000001,0.5384615384615384,0.5384615384615384,0.3333333333333333,0.0769230769230769,0.156173761888606,0,0,284,1,3,138,24,0.5731600766889271,1,48445700-2496,	are there things that care about ``` posts ``` being returned from this method? seems like the handler just ignores it. if this method only has to report errors then no use returning a tuple.
u,83.32400000000003,98.49736842105266,0.5,0.5666666666666667,0.0,0.3666666666666666,0.0964485644340824,3,1,748,1,12,864,174,1.0,1,47520060-2465,	could you change the values here from `True/False` to `'published'/'unpublised'` that was the comparison later on isn't against the string `'true'/'false'`
u,100.0,100.0,0.4444444444444444,0.4814814814814814,0.0,0.074074074074074,0.108465228909328,2,1,748,1,8,864,174,1.0,1,47520617-2465,"	I'm pretty sure a request of `None` would work here, or an empty dict. I think one of the two would work."
u,97.025,97.025,0.3,0.3,1.0,0.0,0.1118033988749894,2,1,107,1,16,134,29,0.0,1,47572185-2462,"	Could probably be ``` === ```, yeah?"
u,71.57033962264155,99.17469565217392,0.2574257425742574,0.2574257425742574,0.2,0.7326732673267327,0.402331335589365,19,1,489,1,23,63,9,0.0,1,47643593-2462,	Hmm... You're right. The server needs to receive an unpublished Flag. Would you mind fixing this function in your PR? Something like ```              else if (field.name == 'publishingStatus') {                  // convert to boolean                  if (field.value() === 'published') {                      published_flag = true;                  } else if (field.value() === 'unpublished') {                      unpublished_flag = false;                  } else {                      published_flag = null;                      unpublished_flag = null                   }              } ```
u,87.39927419354841,100.0,0.3260869565217391,0.3260869565217391,0.0,0.6086956521739131,0.079555728417573,2,1,107,1,16,134,29,0.0,0,47645705-2462,"	``` == ``` does type-coercion to check equality but, really, you know you want a string so why not do strict equality (``` === ```).  I don't really care, it's just Much More Better."
u,87.40607142857144,100.0,0.5,0.5,0.5,0.1666666666666666,0.3086066999241838,0,0,2342,1,10,3577,657,0.0,0,47325242-2450,	shouldn't we be setting `account.salesPerson.updated` here too? it doesn't look like it was getting set before either
u,72.07326923076926,72.07326923076926,0.5,0.5,0.5,0.025,0.2267786838055363,0,0,2342,0,0,3574,656,0.0,1,47161711-2445,	any chance you'd be able to use getBySrid instead here? RepInt accounts are keyed off srid so it's a cheaper/faster/consistent lookup as opposed to getByAgid which is doing a query instead of a key.get()
u,87.48875000000001,80.30636363636367,0.2682926829268293,0.2682926829268293,0.0,0.3658536585365853,0.3104602102825331,0,0,34,0,0,122,14,0.1891464974973842,1,47258705-2445,"	This expected format comment shows a header line but your sentence above says ""without headers"".  Just to be clear, change this to: ```         expected format:         AG-1234,cust-1234         AG-5678,cust-5678"""""" ```"
u,91.84272727272727,93.05,0.4230769230769231,0.4230769230769231,0.5,0.1346153846153846,0.1973855084879307,0,0,34,0,0,122,14,0.1891464974973842,0,47258985-2445,"	Why are you accepting two different key formats?  Also, I don't think you can use a `csv.DictReader` without headers. How would this `.get('key')` know which column in the file has that key? This code looks like it is expecting CSV headers."
u,66.7871428571429,100.0,0.3181818181818182,0.3181818181818182,1.0,0.6363636363636364,0.5407380704358752,0,0,34,0,0,122,14,0.1891464974973842,0,47259233-2445,	What does `updateUnique` do?  Why not just: ``` account.customer_id = customer_id account.put() ``` ?
u,69.18177631578948,79.75538461538463,0.4848484848484848,0.4848484848484848,0.5,0.1515151515151515,0.3721042037676254,0,0,34,0,0,122,14,0.1891464974973842,0,47259452-2445,"	This line is very awkward. We are building a customer ID and storing it in a `customer_id` variable but that function takes in an arg also called `customer_id`. Why is the original value of the variable not good enough? I thought customer IDs were just strings anyway, what could this `buildCustomerId` function possibly be doing?"
u,82.07541666666668,82.07541666666668,0.5492957746478874,0.5492957746478874,0.25,0.0140845070422535,0.3789266242639078,0,0,2342,0,0,3574,656,0.0,0,47292312-2445,	Why did you change this from using updateUnique? I know @jwebb-va asked why we were using it but there is a reason to do so... it handles the updating of the unique entity for you and also ensures that it's in the correct format (pid/id). So you can replace about 15-20 lines here with the one call to updateUnique instead.
u,74.8616666666667,88.33754901960786,0.4347826086956521,0.4347826086956521,0.0,0.1956521739130435,0.2776840538002493,0,0,93,1,7,162,16,0.6882162524276129,0,47158578-2444,	I'd say `generate_content` is a bit too ambiguous here. Even within the context of this module it's not clear what this actually does or returns. Even something like `generate_review_share_content` would be much clearer imo.
u,100.0,100.0,0.6666666666666666,0.6666666666666666,1.0,0.0,0.0,0,0,93,1,6,162,16,0.678476496665327,1,47158625-2444,	Why not just `{}`?
u,61.53250000000003,64.9245454545455,0.3846153846153846,0.3846153846153846,1.0,0.6923076923076923,0.2651974176527183,0,0,93,1,1,104,15,0.0,1,47358780-2441,"	Minor, but is it necessary to wrap all these methods around `function () {...}` if you aren't passing any ""custom"" args? Can't you just `click: $root.showTrendOrWordCloudAdvice`?"
nu,100.0,100.0,0.3461538461538461,0.3461538461538461,0.5,0.1923076923076923,0.3124999999999999,0,0,94,1,5,73,20,0.4549484800017944,0,68089309-7295,"	This seems like a weird check, why is needed?  Is so we don't put the zip code into `anchor_data[KEY.STATE]`"
nu,63.306538461538494,63.306538461538494,0.5,0.5,0.0,0.0384615384615384,0.2581988897471611,0,0,209,0,0,223,56,0.0,0,68057873-7287,	I don't understand why we are using vdatastore stuff in this model instead of making a vobject in the vobject lib and inheriting from that
nu,80.67772727272727,100.0,0.5,0.5,0.0,0.2692307692307692,0.2857142857142857,14,1,1591,1,36,1576,300,0.8974695565860575,1,67775805-7282,	Seems like we can move the construction of `test_facebook_post` to the setup and just change the `postedDateTime` before the put.
nu,99.13250000000002,99.13250000000002,0.5357142857142857,0.5357142857142857,0.0,0.0357142857142857,0.0589255650988789,0,0,2387,1,1,1413,209,0.0,1,67755524-7281,	I'd remove the default here if we expect this to always have a value. Better than providing an empty string where we wouldn't want one.
nu,66.56038461538463,100.0,0.25,0.25,0.0,0.75,0.035578403348241,0,0,3166,1,1,1480,290,0.5362959502413459,1,67759066-7281,"	+1 this will fail with a cryptic error: ``` >>> ""{}{}"".format("""") Traceback (most recent call last):   File ""<stdin>"", line 1, in <module> IndexError: tuple index out of range ```"
nu,100.0,100.0,0.375,0.375,1.0,0.125,0.3354101966249684,0,0,0,0,0,0,0,0.0,1,67712055-7279,	Were we wanting to change the SDK files?
nu,77.81071428571428,77.81071428571428,0.7857142857142857,0.7857142857142857,0.0,0.0714285714285714,0.0668153104781061,0,0,13,1,2,6,1,0.0,1,67713988-7279,	they will just get overwritten but it is all just doc string changes anyway
nu,100.0,100.0,0.0,0.0,0.0,1.0,0.0,0,0,0,0,0,0,0,0.0,1,67717397-7279,	Fair!
nu,100.0,100.0,0.5,0.5,0.0,0.0333333333333333,0.2138089935299394,0,0,237,1,2,221,29,0.0,0,67719415-7279,	I would revert this file. It'll be confusing to the next person who generates the SDK when they have 18 lines they didn't know were changes.
nu,92.965,92.965,0.4444444444444444,0.4444444444444444,0.0,0.1111111111111111,0.0944911182523068,4,1,237,1,3,221,29,0.0,1,67719620-7279,	This is literally the 1 line that matters.
nu,87.94500000000002,87.94500000000002,0.1666666666666666,0.1666666666666666,0.0,0.1666666666666666,0.2721655269759087,61,1,3166,1,64,1478,289,0.7132563134989169,1,67551641-7275,	Good job on a descriptive tag!
nu,52.86500000000001,52.86500000000001,0.5,0.5,0.0,0.1,0.1825741858350553,61,1,3166,1,64,1478,289,0.7132563134989169,1,67551826-7275,	You aren't passing any arguments to your deferred function.
nu,95.68818181818185,95.68818181818185,0.5454545454545454,0.5454545454545454,0.0,0.0909090909090909,0.2508726030021272,66,1,3166,1,43,1478,289,0.6557920634651871,1,67551931-7275,	It would save effort to do this check before the defer.
nu,100.0,100.0,0.2666666666666666,0.2666666666666666,0.0,0.0666666666666666,0.1543033499620919,2,1,169,1,13,171,45,0.0,1,67552369-7275,	yeah.. I messed up hehe. I was in a bit of a rush
nu,66.7871428571429,66.7871428571429,0.7142857142857143,0.7142857142857143,1.0,0.1428571428571428,0.0,0,0,169,1,1,171,45,0.0,1,68099888-7275,	I really like how you encapsulate this ?
nu,,,0.0,0.0,0.0,1.0,0.0,2,1,169,1,13,171,45,0.0,1,68100273-7275,	?
nu,100.0,100.0,0.625,0.625,1.0,0.125,0.2499999999999999,0,0,3166,1,6,1477,288,0.524034042718821,1,67538347-7272,	do we want to have a retry limit?
nu,76.89000000000003,76.89000000000003,0.4285714285714285,0.4285714285714285,1.0,0.1428571428571428,0.0,0,0,3166,1,6,1477,288,0.524034042718821,1,67539105-7272,	or a min-backoff? or something?
nu,77.19916666666668,77.19916666666668,0.3636363636363636,0.3636363636363636,0.0,0.0303030303030303,0.0,3,1,137,1,1,111,27,0.0,1,67375087-7266,"	The docs state >Note that for very large time intervals (greater than 270 years on most platforms) this method will lose microsecond accuracy.  So, just be aware."
nu,70.14470588235295,100.0,0.3636363636363636,0.3636363636363636,0.0,0.9090909090909092,0.420084025208403,0,0,169,1,1,163,44,0.0,1,67215488-7259,	could be  ```python bad_attributes = [attr for attr in data.iterkeys() if attr not in self.ATTRIBUTES] ```
nu,75.50000000000003,100.0,0.1428571428571428,0.1428571428571428,0.0,0.7142857142857143,0.172132593164774,0,0,581,0,0,488,55,0.0,1,67216067-7259,	or `set(data.iterkeys()) - set(self.ATTRIBUTES)`  C-OK
nu,47.21692307692311,47.21692307692311,0.5555555555555556,0.5555555555555556,0.5,0.037037037037037,0.2279211529192759,0,0,174,1,16,254,32,0.0,1,67057626-7253,	Is there any concern that a user will auth their account after exponential backoff has ramped up. Resulting in not updating the reach quickly after authenticating?
nu,100.0,100.0,0.7333333333333333,0.7333333333333333,0.0,0.0666666666666666,0.1749278571353298,0,0,70,1,2,42,10,0.0,1,67023382-7251,	This test will past regardless of the value of the status code we put here
nu,100.0,100.0,0.631578947368421,0.631578947368421,0.0,0.0526315789473684,0.0,6,1,1591,1,24,1554,296,0.0,1,66846012-7241,	SDK should not be in this PR  Try not to generate the SDK until new endpoints are on master.
nu,86.24865591397851,86.24865591397851,0.5072463768115942,0.5072463768115942,0.0,0.0144927536231884,0.0976416832356179,3,1,3488,1,27,1811,308,0.0,1,66847413-7241,"	I'll disagree here. You need to functionally test your endpoint both as a rest call, and through the sdk. You shouldn't release your sdk to VPM until the endpoints are on prod (which is what I think Brad is really getting at), but there is no reason to avoid generating it, testing with it, and getting it PR'd beforehand."
nu,69.31750000000001,69.31750000000001,0.6170212765957447,0.6170212765957447,0.0,0.0212765957446808,0.0912870929175276,6,1,1591,1,24,1554,296,0.0,1,66848743-7241,	@ckurz-va Generating it and merging it into develop will cause merge conflicts for anyone who is simultaneously adding new endpoints to be added to the SDK when they are based off master.  Not the end of the world but something I like to avoid.
nu,63.600714285714304,63.600714285714304,0.4193548387096774,0.4193548387096774,0.0,0.0080645161290322,0.0887356509416113,3,1,3488,1,27,1811,308,0.0,1,66856186-7241,"	It's a very simple process to manage that conflict, (Pull master into branch, regen sdk, confirm your expected changes are still there) and exposes maybe people need to chat to make sure version numbers are incrementing correctly.  I personally like merge conflicts when people are working in the same space so conversations happen. As long as the merge conflict isn't spawning a TON of new work. Plus with a PR out, people who are watching the repo, which should include people currently working in the repo, will notice another team adding an endpoint, and can start the conversation on collaborating the vpm release and such before things get to master."
nu,88.905,88.905,0.56,0.56,1.0,0.04,0.2927700218845599,0,0,3166,1,21,1457,286,0.7299678128538737,1,66867849-7241,	is this the only place we're getting permissions and storing them? Like even on newly created FB Users we're not saving permissions?
nu,0.0,100.0,0.1,0.1,1.0,0.3,0.2750095491084633,0,0,3166,1,21,1457,286,0.7299678128538737,0,66868117-7241,	Also isn't there a `FacebookUserService.fetchSocialPermissions` method?
nu,95.84945652173916,100.0,0.5,0.5,1.0,0.3214285714285714,0.1482498633322202,0,0,695,1,25,367,58,0.4155813868856491,1,66830183-7240,	If we are just storing these in CS is there any reason to use `vobject` and `vdatastore`? Why not just use `ndb.Model`?
nu,76.2342105263158,76.2342105263158,0.5789473684210527,0.631578947368421,0.0,0.0526315789473684,0.2472256930290987,0,0,695,1,25,367,58,0.4155813868856491,0,66830290-7240,	If you are just returning the class name I don't think it is necessary to implement this method.
nu,86.875,86.875,0.7333333333333333,0.7333333333333333,1.0,0.0333333333333333,0.228747855498907,0,0,695,1,25,367,58,0.4155813868856491,0,66831414-7240,"	Why not just make this is a JsonProperty if that is what we are storing? Also are we using this for anything or storing it ""just to have""?"
nu,100.0,100.0,0.5,0.5,1.0,0.25,0.2236067977499789,0,0,351,1,9,277,60,0.0,1,66641991-7229,	why the key change?
nu,100.0,100.0,0.4,0.4,1.0,0.0,0.0680413817439771,0,0,351,1,7,277,60,0.0,0,66642550-7229,	what's the `/` for in this string?  It's not a typo?
nu,92.0625,92.0625,0.5294117647058824,0.5294117647058824,0.5,0.0588235294117647,0.4948716593053935,3,1,3488,1,41,1807,306,0.8711804556060083,1,66800355-7226,	So we have 3 different apis we have to use to interact with Infogroup? Ugh.
nu,,,0.0,0.0,0.0,1.0,0.0,0,0,169,1,2,162,43,0.0,1,66498659-7221,	?
nu,90.95857142857145,90.95857142857145,0.7142857142857143,0.7142857142857143,0.0,0.1428571428571428,0.0,0,0,60,1,1,72,19,0.0,1,66509364-7221,	Sometimes you have to be extra sure
nu,100.0,100.0,0.6,0.6,1.0,0.1,0.1272569525951555,0,0,60,1,11,71,18,0.0,0,66509896-7220,"	I don't think we need this, do we?"
nu,76.83227272727274,76.83227272727274,0.6363636363636364,0.6363636363636364,0.0,0.0454545454545454,0.2335496832484568,0,0,111,1,1,1037,165,0.0,1,66511065-7220,	Normally no but this Url Spider is doing batching like the Listing Spiders so we needed to include it here as well.
nu,99.23460526315787,99.23460526315787,0.5238095238095238,0.5238095238095238,0.0,0.0476190476190476,0.1904761904761904,0,0,60,1,11,71,18,0.0,1,66511829-7220,"	Ah okay, I wasn't sure if this was because of the batching or just an accident. Sounds good!"
nu,66.10000000000002,100.0,0.3571428571428571,0.3571428571428571,1.0,0.7142857142857143,0.588348405414552,0,0,86,1,1,116,18,0.0662266178532521,1,66161493-7208,"	You mean `Unescapable, assuming due to '\' in review.` right?"
nu,100.0,100.0,0.6,0.6,1.0,0.2,0.1690308509457032,5,1,351,1,1,275,59,0.0,1,66160792-7200,	why caplocks in the middle?
nu,100.0,100.0,0.4444444444444444,0.5555555555555556,1.0,0.1111111111111111,0.1285648693066449,0,0,304,0,0,157,37,0.0,1,66265868-7200,	Should this go with the global_sources_dict spreadsheet?
nu,99.52771739130438,99.52771739130438,0.4583333333333333,0.4583333333333333,1.0,0.0416666666666666,0.4545454545454545,0,0,304,0,0,157,37,0.0,0,66267554-7200,	Why are we filtering listings that belong to the account_group and to the partner? Shouldn't the account_group_id be sufficient?
nu,89.6067307692308,89.6067307692308,0.5714285714285714,0.6428571428571429,0.5,0.0714285714285714,0.196116135138184,0,0,3488,1,6,1800,305,0.0,0,66271913-7200,	why are we shortening the import? Makes it more confusing in code later.
nu,87.30000000000003,87.30000000000003,0.4230769230769231,0.4230769230769231,0.5,0.0192307692307692,0.167789013803506,0,0,3488,1,6,1800,305,0.0,1,66272638-7200,"	Do we want to protect from a large number of input docs? I can't remember the max number of entities that can be in a put_multi, but 1-1 with the input doc list could cause errors if a crazy amount of docs are pushed in."
