class,RE,RENL,SWR,SKR,QR,CER,CS,ACF,CT,TAC,RT,RCF,TRC,RP,ExtLib,Sentiment,id,comment_text
nu,63.10363636363638,83.32400000000003,0.4615384615384615,0.5128205128205128,0.0,0.358974358974359,0.3999999999999999,0,0,146,1,12,96,29,0.0,1,60323812-1668,	May want to check if this account group was found for the account group id before `user_interested_in_listing_sync_pro` and if it doesn't you could probably return `{ 'success': False }`
nu,78.24500000000002,78.24500000000002,0.4761904761904761,0.4761904761904761,0.0,0.0476190476190476,0.0851256530758748,0,0,44,1,9,71,23,0.7826451023071447,1,60325403-1668,	I think that should be the responsibility of the API endpoint in salestool.  Let's keep this AJAX endpoint lightweight.
nu,80.78500000000003,80.78500000000003,0.5,0.5,0.0,0.05,0.1195228609334393,0,0,824,1,6,1578,268,0.1325825214724776,1,60415167-1668,	Just a reminder we have to setup the pubsub topics on MS/ST for each environment when they are deployed.
nu,63.62815789473686,66.64503424657538,0.611764705882353,0.6235294117647059,0.0,0.0470588235294117,0.158910431540932,0,0,824,1,4,1578,268,0.6974531980352185,1,60415581-1668,"	In the future I would just return the `sales_person_details` dict from this method and then if the view (or whoever wants to make use of this method) chooses to serialize it to json they can do that on their own. As it is right now if, for example, they wanted to add an extra key/value they would have to deserialize, add key/value, and then serialize it again which is obviously not ideal."
nu,67.53135135135136,73.08026119402986,0.4588235294117647,0.4823529411764706,0.0,0.1647058823529411,0.1916629694999819,0,0,824,1,8,1578,268,0.8251369970070347,0,60416233-1668,	Only problem is this code will fail on the next line because `partner_id` and `market_id` don't exist for `None` object in which case we should probably return a 404 or something.  I don't think it's a big deal though because it's just an internal ajax endpoint that will still fail if the `account_group` doesn't exist anyway (in which case how are they even hitting this endpoint?).
nu,55.28714285714287,55.28714285714287,0.5428571428571428,0.5714285714285714,0.0,0.0285714285714285,0.0890870806374748,0,0,824,1,8,1578,268,0.8251369970070347,0,60416322-1668,	Given that it's an internal ajax endpoint if something goes wrong it'll just raise an exception which I think is probably okay unless we find a specific error scenario we want to handle.
nu,85.78250000000001,82.4775,0.5283018867924528,0.5283018867924528,0.0,0.0943396226415094,0.1066003581778052,18,1,824,1,65,1578,268,0.8365390821372013,0,60416676-1668,	I don't think we should block this from getting merged but we should update ST (if it hasn't been done already) to support `MS`. Otherwise this is going to get super difficult to maintain because in ST it looks like `VBC` is hitting their api.
nu,100.0,100.0,0.5,0.5,0.0,0.5,0.0,8,1,824,1,31,1578,268,0.6554021378287586,1,60416813-1668,	Same here.
nu,100.0,100.0,0.5,0.5,0.0,0.5,0.0,9,1,824,1,31,1578,268,0.6554021378287586,1,60416834-1668,	Same here.
nu,100.0,100.0,0.5,0.5,0.0,0.5,0.0,8,1,824,1,29,1578,268,0.6554021378287586,1,60416852-1668,	Same here.
nu,79.5575,89.51692307692309,0.3684210526315789,0.3684210526315789,0.0,0.3157894736842105,0.0648203723552164,26,1,824,1,20,1578,268,0.0,1,60416998-1668,	In the future JS should be written with methods/variable using `camelCase` instead of `snake_case`.
nu,0.0,0.0,0.0,0.0,0.0,0.5,0.0,10,1,824,1,26,1578,268,0.0,1,60417175-1668,	Lol empowertising.
nu,100.0,100.0,0.5833333333333334,0.5833333333333334,1.0,0.0416666666666666,0.1296407447104328,1,1,824,1,3,1563,267,0.1190250367462191,0,60301727-1667,	Won't this mean MS won't be updated but the change will remain on AA so the two will be out of sync?
nu,100.0,100.0,0.6,0.6,1.0,0.2,0.1230914909793327,1,1,824,1,3,1563,267,0.1081179805439177,1,60302005-1667,	Where/how is this set?
nu,100.0,100.0,0.3333333333333333,0.3333333333333333,1.0,0.0,0.0,3,1,44,1,7,56,22,0.0,1,60294188-1666,	I assume you'll change this `45` to something real in PRD-73?
nu,93.79775362318844,93.79775362318844,0.5185185185185185,0.5185185185185185,0.3333333333333333,0.0185185185185185,0.0,6,1,146,1,17,81,28,0.0,1,60294490-1666,"	Will it always be 45 on prod? I know Pirates are adding Canada sometime this sprint, which will have a different number of sources, so we can calculate the total when we do that.  Edit: Brad is right, PRD-73 looks like the story for that."
nu,100.0,100.0,0.4137931034482758,0.4137931034482758,0.0,0.0344827586206896,0.0,10,1,824,1,16,1563,267,0.0,1,60297474-1666,	Definitely should not be a constant (i.e. 45) we can just pull from the list of directories we have. Can address in PRD-73.
nu,70.14470588235295,70.14470588235295,0.7058823529411765,0.7058823529411765,0.0,0.0588235294117647,0.0,10,1,824,1,16,1563,267,0.0,1,60297547-1666,	The number of directories can and will change without our involvement so it needs to be dynamic.
nu,86.08346153846156,90.82500000000005,0.5714285714285714,0.6071428571428571,0.0,0.0892857142857142,0.1603567451474546,11,1,324,1,15,630,126,0.8863968718898289,1,60249881-1659,"	I can't really tell, but you might benefit from caching the result of `get_social_sync_profiles` I think it's used multiple times within this class. I can't really tell from the PR if it would be used more than once during a single instance of the class though."
nu,90.95857142857145,96.11442307692307,0.4117647058823529,0.4117647058823529,0.0,0.1176470588235294,0.2182178902359924,0,0,44,1,4,42,15,0.0,0,59642634-1649,	You're re-using the `message` variable here.  Maybe rename it to avoid confusion.
nu,58.5006201550388,58.5006201550388,0.3061224489795918,0.3061224489795918,0.0,0.0204081632653061,0.1899342940993965,0,0,44,1,1,42,15,0.0,1,59642944-1649,"	I generally recommend opening a separate, direct-to-master, pull request for upgrading libraries.   This helps avoid conflicts with other people who want to upgrade the library to a still-newer version. It would also make **this** PR a lot easier to navigate."
nu,90.935,90.935,0.4347826086956521,0.4347826086956521,0.5,0.0434782608695652,0.0962250448649376,1,1,44,1,1,42,15,0.0,0,59643095-1649,	Is there not an 'ms' API user for Sales Tool? Probably shouldn't be pretending to be another project here.
nu,53.655,97.025,0.3571428571428571,0.3571428571428571,0.0,0.6428571428571429,0.592999453328881,0,0,824,1,1,1546,262,0.1325825214724776,1,59763077-1649,	`dealing with triggering hotness when user shows interest`  Sounds like friday night.
nu,43.30672535211269,90.1325,0.233009708737864,0.2427184466019417,0.0,0.6601941747572816,0.4518689194467694,11,1,824,1,67,1546,262,0.8405168366635487,1,59765493-1649,"	Minor, but I think this would be a bit more readable if you grabbed the account group off the sales person first.  Part of this is just preferred style but something like: ```python account_group = sales_person.get(self.microsite.agid) sales_person_details = {     'salesPerson': '',     'agid': self.microsite.agid } if account_group:     sales_person_details.update({         'salesPerson': account_group['firstName'],         'email': account_group['email']         # etc.     }) return json.dumps(sales_person_details) ```"
nu,72.32500000000003,72.32500000000003,0.3255813953488372,0.3255813953488372,0.0,0.0232558139534883,0.0810440898473107,0,0,824,0,0,1546,262,0.0,1,59766558-1649,"	I agree, but using Brent's [Pretty Pull Requests](https://chrome.google.com/webstore/detail/pretty-pull-requests-gith/ljnjpkadhhcdniohpfilddnhahoigdec?hl=en) extension you can collapse files/directories you don't want to look at which makes it more bearable."
nu,31.545000000000016,31.545000000000016,0.5,0.5,0.0,0.1666666666666666,0.2041241452319315,26,1,824,1,5,1546,262,0.0,1,59766859-1649,	Some unnecessary indenting going on here.
nu,95.9991666666667,100.0,0.6774193548387096,0.6774193548387096,0.0,0.1612903225806451,0.2051956704170308,26,1,824,1,5,1546,262,0.0,1,59766961-1649,	Minor but in JS we should be using `camelCase`. It looks like you are for `salesPerson` and some of the other fields so please keep that going.
nu,92.43000000000002,92.43000000000002,0.6,0.6,0.5,0.04,0.2727723627949905,0,0,146,1,2,59,20,0.0,1,59792731-1649,	Is it possible for the account group to be missing any of these? Maybe using get would be better incase a key is missing.
nu,100.0,100.0,0.625,0.625,0.0,0.0625,0.1212678125181664,0,0,146,1,2,59,20,0.0,1,59793685-1649,"	Ok, just as long as they keys do get passed back from the api call."
nu,80.09764705882354,80.09764705882354,0.7058823529411765,0.7058823529411765,0.0,0.0588235294117647,0.1814436846506057,2,1,113,1,2,48,6,0.9911125806211109,1,58709617-1639,	Would look a bit better if this validation can be moved to the beginning of the function.
nu,100.0,100.0,1.0,1.0,1.0,0.25,0.0,0,0,201,1,5,389,70,0.0,1,58442216-1637,	what does this do?
nu,100.0,100.0,1.0,1.0,0.0,1.0,0.0,0,0,201,1,5,389,70,0.0,1,58444208-1637,	thanks
nu,100.0,100.0,0.625,0.625,0.0,0.025,0.0771516749810459,5,1,324,1,1,601,121,0.1458649914978945,1,58398708-1636,"	These sidebar redirect handlers are the same in rm, sm and ms, or at least should be the same. If you need to make a change here you should also make that change in the other products"
nu,100.0,100.0,0.375,0.375,0.0,0.25,0.0,4,1,324,1,5,601,121,0.5605575562589601,1,58398839-1636,	this is the `vauth` lib fyi
nu,100.0,100.0,0.625,0.625,1.0,0.125,0.0944911182523068,0,0,201,1,2,368,62,0.0138016398012306,1,57780346-1625,"	it still works without ""www"" right?"
nu,77.1025,77.1025,0.5882352941176471,0.5882352941176471,1.0,0.0588235294117647,0.2461829819586654,1,1,201,1,2,361,61,0.14457873299156,1,57618573-1623,	So this function will only affect old_mappings that have no redirects? Is that on purpose?
nu,73.75411290322583,73.75411290322583,0.46875,0.46875,0.5,0.03125,0.3053040891987413,0,0,68,0,0,17,7,0.776448589083428,1,57629602-1623,	Should this be refactored to use our new update method? It looks like add_hostslug_msid_mapping and remove_msid_for_hostname together kind of work like our new update method.
nu,100.0,100.0,1.0,1.0,1.0,0.125,0.0,1,1,201,1,8,358,60,0.0,1,57341398-1618,	so these other pages are still in use?
nu,73.84500000000001,100.0,0.4444444444444444,0.4444444444444444,0.0,0.2777777777777778,0.1543033499620919,4,1,186,1,41,598,86,0.8281575471143436,0,56388712-1613,"	~~can you do this with ``` ReviewDocument.get_reviews ```?~~ nevermind, you can't"
nu,59.10000000000004,59.10000000000004,0.625,0.625,0.0,0.0416666666666666,0.0745355992499929,4,1,186,1,41,598,86,0.8281575471143436,1,56575263-1613,	you probably want to test that the query you build in this method is scoped to the specified agid and filters out unpublished reviews
nu,95.58637096774196,100.0,0.3658536585365853,0.3658536585365853,0.0,0.0975609756097561,0.0816496580927726,4,1,186,1,41,598,86,0.8281575471143436,1,56580249-1613,	Right. ``` scaled_stars ``` is the source-agnostic property and is normalized from 0 to 1000. You'd have to translate back to 1-5 once you got a number back though.
nu,70.8463963963964,78.24500000000002,0.1836734693877551,0.2244897959183673,0.0,0.7959183673469388,0.4293148314346895,4,1,324,1,13,599,120,0.7334116797771758,1,55857776-1606,	could you break out the logic here into separate functions ```python if service_type == CS_KEY.FS_VENU:     context = self._setup_foursuqare_context(context) elif service_type == CS_KEY.FB_PAGE:     context = self._setup_facebook_context(context) ```
nu,84.845,84.845,0.5882352941176471,0.5882352941176471,0.0,0.0588235294117647,0.2080125735844609,0,0,113,1,2,29,1,0.0,1,56175252-1606,"	As pointed out by Shawn, it could be better to use gritter instead of console log"
nu,84.15181818181821,84.15181818181821,0.7307692307692307,0.7307692307692307,0.0,0.0384615384615384,0.3030457633656632,0,0,113,1,2,29,1,0.0,1,56176422-1606,"	I might be too picky here, but ++index is usually used only when necessary. Use index++ if it does the same thing"
nu,90.4613775510204,90.4613775510204,0.5344827586206896,0.5517241379310345,0.0,0.0172413793103448,0.3486035027075053,0,0,113,1,3,29,1,0.0,1,56194092-1606,"	No need to bind the $data in the click function. use bind only when you need to pass extra params except the current $data. By default, there will be two params passed to the function, the 1st one is the $data and the 2nd one is the event details."
nu,100.0,100.0,0.3333333333333333,0.3333333333333333,1.0,0.3333333333333333,0.0,0,0,113,1,2,29,1,0.0,1,56194783-1606,	A loop here?
nu,86.14857142857144,86.14857142857144,0.4848484848484848,0.5,0.3333333333333333,0.0151515151515151,0.2864459496157732,4,1,324,1,3,558,118,0.3938662490471004,0,55535398-1589,"	Instead of spreading out a bunch of logic to stop gmb stuff when it's disabled, can you pass this into the context and just hide it from the UI?  That's generally the route we go when we put stuff behind a feature flipper.  It's a lot easer to remove later as you aren't changing any of the underlying logic"
nu,82.82961538461542,82.82961538461542,0.5555555555555556,0.5555555555555556,0.0,0.037037037037037,0.2495670992423108,1,1,324,0,0,558,118,0.0,0,55543130-1589,"	I don't think the account will ever have a location cursor, as that doesn't show up until our first call to get the locations"
nu,99.905,99.905,0.6818181818181818,0.6818181818181818,0.0,0.0454545454545454,0.2750095491084633,1,1,324,0,0,558,118,0.0,1,55543257-1589,	the account won't have locations to start with anymore as that work would now have to be done in the JS
nu,58.25392857142859,97.025,0.5,0.5,0.0,0.5,0.4618802153517005,1,1,324,0,0,558,118,0.0,1,55543401-1589,	`if (!self.locationCursor())` would work better here
nu,75.28382352941179,79.85387096774194,0.6153846153846154,0.6923076923076923,0.0,0.1538461538461538,0.3872983346207417,1,1,324,0,0,558,118,0.0,0,55543628-1589,"	You can just `return` here, you don't need to `return true` as that implies that there could be a different return type when it's not actually going to be used for anything"
nu,78.10979166666668,82.12,0.5942028985507246,0.5942028985507246,0.0,0.0289855072463768,0.3273268353539886,0,0,324,0,0,558,118,0.0,1,55544497-1589,"	the general convention is to do this before the ajax call instead of relying on the ajax beforeSend.  That being said, I'm pretty sure we did it that way because no one knew about this `beforeSend`.  You might have some trouble writing a test for this, but if you can follow the same pattern for testing the success function then it should work."
nu,100.0,100.0,0.5714285714285714,0.5714285714285714,0.0,0.0204081632653061,0.2117024496099852,1,1,324,0,0,558,118,0.0,0,55545018-1589,	We don't want to leave console.log's in the JS as they won't be helpful to anyone (the end user won't be able to see it). We can use a $.gritter call here which will tell the user that something went wrong
nu,85.16878424657536,85.16878424657536,0.6153846153846154,0.6153846153846154,0.0,0.0128205128205128,0.4880935300919763,1,1,324,0,0,558,118,0.0,1,55546995-1589,"	All of the operations in this function deal with the account that is passed in.  Instead of passing the account in to this function, the click event should be handled by the account model.  The only thing that this function can do is set the other accounts to being not selected.  If you select one account then select the next one, we can leave the previous one as selected so it stays open."
nu,100.0,100.0,0.7142857142857143,0.7142857142857143,0.0,0.0714285714285714,0.2504897164340597,1,1,324,0,0,558,118,0.0,0,55547332-1589,	this doesn't need to be defined if there's nothing in the function
nu,80.67772727272727,80.67772727272727,0.5434782608695652,0.5652173913043478,0.0,0.0217391304347826,0.0610847221781526,0,0,324,0,0,558,118,0.0,0,55549642-1589,"	We generally want to avoid using id's in styles as much as possible as it's hard to overwrite them.  This isn't worth changing, but just for future reference if you want to style something the default should be using a class"
nu,87.94500000000002,87.94500000000002,0.2857142857142857,0.2857142857142857,0.0,0.1428571428571428,0.0990147542976674,1,1,324,0,0,558,118,0.0,1,55753655-1589,"	Ah, I thought there was collapsing"
nu,100.0,100.0,0.7222222222222222,0.7222222222222222,0.0,0.0555555555555555,0.1450952500220023,1,1,324,0,0,558,118,0.0,0,55753949-1589,"	it'd be nice to indicate that somehow, I'm not really sure the best way though"
nu,99.48,99.48,0.48,0.56,0.0,0.04,,0,0,324,0,0,558,118,0.2315917782932927,0,55532349-1589,	None of these kwargs are optional.  If you make them args instead of kwargs then you don't need the check/raise ValueError stuff.
nu,38.37772727272727,60.63428571428573,0.625,0.6666666666666666,0.0,0.0833333333333333,,0,0,324,0,0,558,118,0.2315917782932927,1,55534175-1589,	As this is now in the GoogleMyBusinessSync class it can probably be named something like `getConnectedLocation` as the GMB is already implied
nu,74.39580645161291,82.82961538461542,0.5428571428571428,0.5428571428571428,0.0,0.2285714285714285,,0,0,324,0,0,558,118,0.1276318675606577,1,55541317-1589,	if you make this `self.request.get` instead of `params.get` then you can set self.request as a dictionary in the tests and it's a lot easier to test
nu,58.25392857142859,97.025,0.5,0.5,0.0,0.5,0.4618802153517005,1,1,324,0,0,558,118,0.0,1,55543401-1589,	`if (!self.locationCursor())` would work better here
nu,75.28382352941179,79.85387096774194,0.6153846153846154,0.6923076923076923,0.0,0.1538461538461538,0.3872983346207417,1,1,324,0,0,558,118,0.0,0,55543628-1589,"	You can just `return` here, you don't need to `return true` as that implies that there could be a different return type when it's not actually going to be used for anything"
nu,78.10979166666668,82.12,0.5942028985507246,0.5942028985507246,0.0,0.0289855072463768,0.3273268353539886,0,0,324,0,0,558,118,0.0,1,55544497-1589,"	the general convention is to do this before the ajax call instead of relying on the ajax beforeSend.  That being said, I'm pretty sure we did it that way because no one knew about this `beforeSend`.  You might have some trouble writing a test for this, but if you can follow the same pattern for testing the success function then it should work."
nu,55.57500000000003,55.57500000000003,0.72,0.72,0.0,0.04,0.3481553119113957,1,1,146,1,7,35,12,0.96934521486465,1,54899849-1588,"	Not sure how everyone feels about a super get, but maybe this check could be added to BaseReviewWidgetHandler instead of doing it in each."
nu,100.0,100.0,0.0909090909090909,0.0909090909090909,0.0,0.0303030303030303,0.0,0,0,44,1,2,34,13,0.0,1,54899870-1588,	To make GitHub shut up: ![image](https://cloud.githubusercontent.com/assets/8963131/13500008/36108572-e126-11e5-9867-9cd2b27b85f8.png)
nu,49.19282258064519,57.23363636363638,0.2790697674418604,0.3023255813953488,0.0,0.3720930232558139,0.1756820922315766,0,0,18,1,6,31,9,0.0,1,54905434-1588,	It is often a bad idea to do unicode conversions with accounting for encoding errors. You can either: * `except ValueError` * pass kwarg `errors=ignore` or `errors=replace` to work around errors
nu,100.0,100.0,0.2941176470588235,0.2941176470588235,0.5,0.1176470588235294,0.0294627825494394,0,0,18,1,3,31,9,0.0,1,54905994-1588,	Isn't `_public` an oxy-moron in the Python world? :stuck_out_tongue:
nu,100.0,100.0,0.3846153846153846,0.3846153846153846,1.0,0.3846153846153846,0.1290994448735805,6,1,89,1,6,249,9,0.0,0,54467814-1587,	we can't use ``` operation.db.put() ``` here?
nu,100.0,100.0,0.2894736842105263,0.2894736842105263,1.0,0.5,0.373829572563511,4,1,186,1,39,553,79,0.8237222085724508,0,52361694-1560,	whats with ``` ua_mobile_profile == PR_MOBILE_IOS and source_id == GOOGLE_MAPS_SOURCE_ID ``` ? We don't want to link to gmaps if they are on mobile?
nu,99.01212121212124,100.0,0.4264705882352941,0.4264705882352941,0.25,0.1029411764705882,0.2493773340269082,9,1,80,1,4,56,10,0.9681170899733264,1,52363949-1560,"	Did you guys miss the comment right above? [MS-2252](https://vendasta.jira.com/browse/MS-2252) has the details on this, but to sum up, the second clause on the `if` can be removed completely if we have a working links to Google Maps reviews to share the review. (ie. just `if source_listing:`)"
nu,100.0,100.0,0.4545454545454545,0.4545454545454545,0.0,0.2727272727272727,0.0,2,1,186,1,22,546,78,0.0,1,51314541-1557,	this should be an ``` a ``` tag now
nu,97.025,100.0,0.2,0.2,0.0,0.6,0.0,0,0,146,0,0,1,1,0.0,1,50869875-1549,	Ah ok `COMPLETE-OK`
nu,80.91708333333335,69.14500000000001,0.35,0.375,0.5,0.45,0.2603778219616477,0,0,18,0,0,24,8,0.0,0,50547021-1548,"	Does this bug also affect these FAVICONs being served below? If not, why not? They are using `http` exclusively.  `return 'http://' + self.request.host + mapping.get_url()`"
nu,26.93400000000005,40.832857142857165,0.4545454545454545,0.5113636363636364,0.0,0.1704545454545454,0.3595732599803958,3,1,186,1,8,526,69,0.8814030927084047,0,49878022-1541,"	you could also do this by saying  ``` return set_review_shared(self.agid, self.rid) or self.abort(400) ``` although i find that kinda weird. if you want to return a 400 if something goes wrong in core, it's clearer to catch the exception here and abort in the exception handler rather than catch it in the underlying layer, return None, and then have a special meaning for a None value in this layer"
nu,50.270263157894775,89.865,0.32,0.36,0.0,0.52,0.393863180721688,3,1,186,1,8,526,69,0.8814030927084047,1,49880308-1541,"	ya what im suggesting is  ``` try:   return set_review_shared(self.agid, self.rid) except CoreApiException as e:   logging.warning(e)   return self.abort(400) ```  and then the core api wrapper method going back to being 2 lines"
nu,80.75019230769233,92.38678571428576,0.42,0.42,0.0,0.14,0.1472642081021447,1,1,824,1,32,1468,246,0.229839055204115,1,49511401-1531,"	I was just looking through the `msid_selector` code (which handles `redirect_hostslug`) and, yes, I think you are correct, this should be fine. Especially if you grabbed it from the code that generates the ""View Location Page"" link."
nu,37.1866150442478,57.41538226299696,0.4609375,0.4609375,0.0,0.0546875,0.3178542458730997,4,1,186,1,20,509,65,1.0,0,49158324-1529,	@sgryschuk-va @tbathgate-va @bjohnson-va  so... sendwithus completely obscures what the links actually are (thye get turned into giant unreadable things). as long as the user doesn't see a microsite load up on microsite-prod.appspot.com (ie non whitelabelled domain) then from their perspective theres no difference between the WL domain and our domain unless they are exceptionally tech savvy for a random spam victim.  I think we could just give them a vanilla url that does the same thing and cut out all of this communication between CS and MS when CS goes to send the email.  ``` _get_review_deep_link ``` could just as easily exist on the vobject
nu,57.55785714285717,57.55785714285717,0.4666666666666667,0.4666666666666667,0.0,0.0333333333333333,0.2581988897471611,4,1,186,1,20,509,65,1.0,1,49377610-1529,	generally our urls should be lowercase with dashes between words like microsite/send-request-share-review-email  if you found 'MicroSite' somewhere in MS that's old school
nu,25.801000000000016,31.40586956521741,0.4137931034482758,0.4137931034482758,0.0,0.1034482758620689,0.212522571344742,4,1,186,1,20,509,65,1.0,1,49378206-1529,	you can get the reviews and ``` get_enabled_listing_sources ``` asynchronously. if you havent seen https://cloud.google.com/appengine/docs/python/ndb/async#tasklets id check it out. a tasklet decorator can turn any python function into a (pseudo)asynchronous method. we can refactor it together if you want
nu,68.53333333333333,69.88905797101451,0.5283018867924528,0.5283018867924528,0.0,0.0566037735849056,0.2710523708715753,2,1,186,1,17,509,65,0.8575374649618096,1,49380685-1529,"	id look at initializing these mocks in your ``` setUp ```. If a mock is needed for every or almost every test, then might as well store it on the testCase instance in setUp. Allows you to get rid of all the nasty decorators and arguments into test functions."
nu,26.89948275862069,31.39166666666669,0.5074626865671642,0.5074626865671642,0.0,0.0746268656716417,0.1920238431606421,2,1,186,1,17,509,65,0.8575374649618096,1,49381035-1529,"	if you'd like to put this mock into the setUp, you could change this test case to inherit from VTestCase, which is a thin wrapper about unittest.TestCase with some convenient assertions and (more importantly) the easy ```mock_function_in_setup ``` call (or whatever its called now) which lets you put this on an instance attribute easily"
nu,61.32500000000002,61.32500000000002,0.5,0.5,0.0,0.1,0.2886751345948129,2,1,186,1,17,509,65,0.8575374649618096,1,49381258-1529,	same comment here about patch decorators vs setUp and VTestCase
nu,24.065,83.0092307692308,0.3703703703703703,0.3703703703703703,0.0,0.2962962962962963,0.2117024496099852,12,1,824,1,18,1415,242,0.6278860829120475,1,48059473-1518,"	Minor, but the page, msid, pid, etc. are already added via `MicrositeGeneralView.get` and `MicrositeView.render_response` methods."
nu,41.38924418604654,53.29000000000005,0.5833333333333334,0.5833333333333334,0.0,0.125,0.3535533905932738,6,1,824,1,11,1415,242,0.5784697271863481,1,48059765-1518,	I would really like to see this file completely deleted and for reviews to use existing page logic. Also instead of overriding the `page` property in these handlers you could potentially just insert that logic into `MicrositeGeneralView.page` but that might get messy...
